{
  "version": 2,
  "status": "prototype",
  "note": "Official per-species PokéAPI growth-rate thresholds, levels 1–100; defeat rewards are the separately versioned prototype rule.",
  "growthCurves": {
    "pokeapi_growth_fast_v1": {
      "totalExperience": [
        0,
        6,
        21,
        51,
        100,
        172,
        274,
        409,
        583,
        800,
        1064,
        1382,
        1757,
        2195,
        2700,
        3276,
        3930,
        4665,
        5487,
        6400,
        7408,
        8518,
        9733,
        11059,
        12500,
        14060,
        15746,
        17561,
        19511,
        21600,
        23832,
        26214,
        28749,
        31443,
        34300,
        37324,
        40522,
        43897,
        47455,
        51200,
        55136,
        59270,
        63605,
        68147,
        72900,
        77868,
        83058,
        88473,
        94119,
        100000,
        106120,
        112486,
        119101,
        125971,
        133100,
        140492,
        148154,
        156089,
        164303,
        172800,
        181584,
        190662,
        200037,
        209715,
        219700,
        229996,
        240610,
        251545,
        262807,
        274400,
        286328,
        298598,
        311213,
        324179,
        337500,
        351180,
        365226,
        379641,
        394431,
        409600,
        425152,
        441094,
        457429,
        474163,
        491300,
        508844,
        526802,
        545177,
        563975,
        583200,
        602856,
        622950,
        643485,
        664467,
        685900,
        707788,
        730138,
        752953,
        776239,
        800000
      ]
    },
    "pokeapi_growth_medium-slow_v1": {
      "totalExperience": [
        0,
        9,
        57,
        96,
        135,
        179,
        236,
        314,
        419,
        560,
        742,
        973,
        1261,
        1612,
        2035,
        2535,
        3120,
        3798,
        4575,
        5460,
        6458,
        7577,
        8825,
        10208,
        11735,
        13411,
        15244,
        17242,
        19411,
        21760,
        24294,
        27021,
        29949,
        33084,
        36435,
        40007,
        43808,
        47846,
        52127,
        56660,
        61450,
        66505,
        71833,
        77440,
        83335,
        89523,
        96012,
        102810,
        109923,
        117360,
        125126,
        133229,
        141677,
        150476,
        159635,
        169159,
        179056,
        189334,
        199999,
        211060,
        222522,
        234393,
        246681,
        259392,
        272535,
        286115,
        300140,
        314618,
        329555,
        344960,
        360838,
        377197,
        394045,
        411388,
        429235,
        447591,
        466464,
        485862,
        505791,
        526260,
        547274,
        568841,
        590969,
        613664,
        636935,
        660787,
        685228,
        710266,
        735907,
        762160,
        789030,
        816525,
        844653,
        873420,
        902835,
        932903,
        963632,
        995030,
        1027103,
        1059860
      ]
    },
    "pokeapi_growth_medium_v1": {
      "totalExperience": [
        0,
        8,
        27,
        64,
        125,
        216,
        343,
        512,
        729,
        1000,
        1331,
        1728,
        2197,
        2744,
        3375,
        4096,
        4913,
        5832,
        6859,
        8000,
        9261,
        10648,
        12167,
        13824,
        15625,
        17576,
        19683,
        21952,
        24389,
        27000,
        29791,
        32768,
        35937,
        39304,
        42875,
        46656,
        50653,
        54872,
        59319,
        64000,
        68921,
        74088,
        79507,
        85184,
        91125,
        97336,
        103823,
        110592,
        117649,
        125000,
        132651,
        140608,
        148877,
        157464,
        166375,
        175616,
        185193,
        195112,
        205379,
        216000,
        226981,
        238328,
        250047,
        262144,
        274625,
        287496,
        300763,
        314432,
        328509,
        343000,
        357911,
        373248,
        389017,
        405224,
        421875,
        438976,
        456533,
        474552,
        493039,
        512000,
        531441,
        551368,
        571787,
        592704,
        614125,
        636056,
        658503,
        681472,
        704969,
        729000,
        753571,
        778688,
        804357,
        830584,
        857375,
        884736,
        912673,
        941192,
        970299,
        1000000
      ]
    },
    "pokeapi_growth_slow_v1": {
      "totalExperience": [
        0,
        10,
        33,
        80,
        156,
        270,
        428,
        640,
        911,
        1250,
        1663,
        2160,
        2746,
        3430,
        4218,
        5120,
        6141,
        7290,
        8573,
        10000,
        11576,
        13310,
        15208,
        17280,
        19531,
        21970,
        24603,
        27440,
        30486,
        33750,
        37238,
        40960,
        44921,
        49130,
        53593,
        58320,
        63316,
        68590,
        74148,
        80000,
        86151,
        92610,
        99383,
        106480,
        113906,
        121670,
        129778,
        138240,
        147061,
        156250,
        165813,
        175760,
        186096,
        196830,
        207968,
        219520,
        231491,
        243890,
        256723,
        270000,
        283726,
        297910,
        312558,
        327680,
        343281,
        359370,
        375953,
        393040,
        410636,
        428750,
        447388,
        466560,
        486271,
        506530,
        527343,
        548720,
        570666,
        593190,
        616298,
        640000,
        664301,
        689210,
        714733,
        740880,
        767656,
        795070,
        823128,
        851840,
        881211,
        911250,
        941963,
        973360,
        1005446,
        1038230,
        1071718,
        1105920,
        1140841,
        1176490,
        1212873,
        1250000
      ]
    }
  },
  "evolutions": [
    {
      "fromSpeciesId": 1,
      "toSpeciesId": 2,
      "minimumLevel": 16,
      "assetId": "pokeapi-evolution-2-v1-webp"
    },
    {
      "fromSpeciesId": 4,
      "toSpeciesId": 5,
      "minimumLevel": 16,
      "assetId": "pokeapi-evolution-5-v1-webp"
    },
    {
      "fromSpeciesId": 7,
      "toSpeciesId": 8,
      "minimumLevel": 16,
      "assetId": "pokeapi-evolution-8-v1-webp"
    },
    {
      "fromSpeciesId": 10,
      "toSpeciesId": 11,
      "minimumLevel": 7,
      "assetId": "veloria-creatures-3-v1"
    },
    {
      "fromSpeciesId": 11,
      "toSpeciesId": 12,
      "minimumLevel": 10,
      "assetId": "veloria-creatures-3-v1"
    },
    {
      "fromSpeciesId": 13,
      "toSpeciesId": 14,
      "minimumLevel": 7,
      "assetId": "veloria-creatures-4-v1"
    },
    {
      "fromSpeciesId": 14,
      "toSpeciesId": 15,
      "minimumLevel": 10,
      "assetId": "veloria-creatures-4-v1"
    },
    {
      "fromSpeciesId": 16,
      "toSpeciesId": 17,
      "minimumLevel": 18,
      "assetId": "pokeapi-evolution-17-v1-webp"
    },
    {
      "fromSpeciesId": 19,
      "toSpeciesId": 20,
      "minimumLevel": 20,
      "assetId": "pokeapi-evolution-20-v1-webp"
    },
    {
      "fromSpeciesId": 161,
      "toSpeciesId": 162,
      "minimumLevel": 15,
      "assetId": "pokeapi-evolution-162-v1-webp"
    },
    {
      "fromSpeciesId": 163,
      "toSpeciesId": 164,
      "minimumLevel": 20,
      "assetId": "pokeapi-evolution-164-v1-webp"
    },
    {
      "fromSpeciesId": 179,
      "toSpeciesId": 180,
      "minimumLevel": 15,
      "assetId": "pokeapi-evolution-180-v1-webp"
    },
    {
      "fromSpeciesId": 194,
      "toSpeciesId": 195,
      "minimumLevel": 20,
      "assetId": "pokeapi-evolution-195-v1-webp"
    },
    {
      "fromSpeciesId": 72,
      "toSpeciesId": 73,
      "minimumLevel": 30,
      "assetId": "pokeapi-coast-73-v1-webp"
    },
    {
      "fromSpeciesId": 98,
      "toSpeciesId": 99,
      "minimumLevel": 28,
      "assetId": "pokeapi-coast-99-v1-webp"
    },
    {
      "fromSpeciesId": 170,
      "toSpeciesId": 171,
      "minimumLevel": 27,
      "assetId": "pokeapi-coast-171-v1-webp"
    },
    {
      "fromSpeciesId": 79,
      "toSpeciesId": 80,
      "minimumLevel": 37,
      "assetId": "pokeapi-lake-80-v1-webp"
    },
    {
      "fromSpeciesId": 96,
      "toSpeciesId": 97,
      "minimumLevel": 26,
      "assetId": "pokeapi-lake-97-v1-webp"
    },
    {
      "fromSpeciesId": 177,
      "toSpeciesId": 178,
      "minimumLevel": 25,
      "assetId": "pokeapi-lake-178-v1-webp"
    },
    {
      "fromSpeciesId": 2,
      "toSpeciesId": 3,
      "minimumLevel": 32,
      "assetId": "pokeapi-starter-finals-3-v1-webp"
    },
    {
      "fromSpeciesId": 5,
      "toSpeciesId": 6,
      "minimumLevel": 36,
      "assetId": "pokeapi-starter-finals-6-v1-webp"
    },
    {
      "fromSpeciesId": 8,
      "toSpeciesId": 9,
      "minimumLevel": 36,
      "assetId": "pokeapi-starter-finals-9-v1-webp"
    },
    {
      "fromSpeciesId": 180,
      "toSpeciesId": 181,
      "minimumLevel": 30,
      "assetId": "pokeapi-starter-finals-181-v1-webp"
    },
    {
      "fromSpeciesId": 220,
      "toSpeciesId": 221,
      "minimumLevel": 33,
      "assetId": "pokeapi-mountain-221-v1-webp"
    },
    {
      "fromSpeciesId": 86,
      "toSpeciesId": 87,
      "minimumLevel": 34,